ӈирэчеӈэ ӄынутъымэ ганрагтатлен ынӄэн ӄлявыля тъэче эмӈинӄэгл эмнэнэнэльэъым ынӄэн ӄлявылтэ	ӈ и р э ч е ӈ э _ ӄ ы н у т ъ ы м э _ г а н р а гтатлен _ ы н ӄ э н  _ ӄ л я в ы л я _ т ъ э ч е  _ э м ӈ и н ӄ э г л _ э м н э н э н э л ь э ъ ы м _ ы н ӄ э н  _ ӄ л я в ы л т э _
ӄунэчеӈэ ы’ттъыёлкэнъым итыкэ ӄайвыквын ытри ӄайвыквыӈа	ӄ у н э ч е ӈ э _ ы ’ т т ъ ы ё л к э н ъ ы м _ и т ы к э _ ӄ а й в ы к в ы н _ ы т р и _ ӄ а й в ы к в ы ӈ а _
ӈинӄэгти ынан рымэйӈэвнинэт	ӈ и н ӄ э г ти _ ы н а н _ р ы м э й ӈ э в н и н э т  _
ӄоры нэмэӈэ уйӈэ нъэлык тумгытумъым нэмэ ынӄэнэ	ӄ о р ы _ н э м э ӈ э _ у й ӈ э _ н ъ э л ы к _ т у м г ы т у м ъ ы м _ н э м э _ ы н ӄ э н э _
нэмэ ганрагтатлен нэмэӈэ ӈиръэ ӈинӄэгти выквытыӈатъым льэтыӄай	н эмэ _ г а н р а гтатлен _ н э м э ӈ э _ ӈ и р ъ э  _ ӈ и н ӄ э г т и _ в ы к в ы т ы ӈ а т ъ ы м _ л ь э т ы ӄ а й _
янор омваамгыпы такчитэ лымэвыр афтобуча камаза трэлӄытгъэ элгыӄанъявэты	я н ор _ о м в а а м г ы п ы _ т а к ч и т э _ л ы м э в ыр _ а ф т о б у ч а _ к а м а з а _ т р э л ӄ ы т г ъ э _ э л г ы ӄ а н ъ я в э т ы _
илгыӄэнъевык ынкы н киткит тратвагъа тъэр ы’лёӈэт тратвагъа ӄэлюӄы’м гэмо гымнан титэ трэпириӈынэт въэӈэты	и л г ы ӄ э н ъ е в ы к _ ы н к ы _ н _ к и т к и т _ т р а т в а г ъа _ т ъ э р _ ы ’ л ё ӈ эт _ т р а т в а г ъа _ ӄ э л ю ӄ ы ’ м  _ г э м о _ г ы мнан _ т и т э _ т р э п и р и ӈ ы н э т _ в ъ э ӈ э т ы  _
ынӄоры въаӈгыпы въаӈгыпы ынкы трабилетынӈаа’ мачквагты	ы н ӄ о ры _ в ъ а ӈ г ы п ы _ в ъ а ӈ г ы п ы _ ы н к ы _ т р а б и л е т ы н ӈ а а ’ _ м а ч к в а г т ы _
мочквайпы трэриӈээ’ чанктпитирбургэты	м о ч к в а й п ы _ т р э р и ӈ э э ’ _ ч а н к т п и т и р б у р г э т ы _
ынкы трэльуӈынэт гымнинэт чакэттомгыӄай лярича ынкъам гымнин ӈавытлывэӄай vиталина	ы н к ы _ т р э л ь у ӈ ы н э т _ г ы м н и н э т _ ч а к э т т о м г ы ӄ а й _ л я р и ч а _ ынкъам _ г ы м н и н _ ӈ а в ы т л ы в э ӄ а й _ v и т а л и н а _
мэсӄээӄын ынкы мытратваа’ дианана транкалровӈынат лыгэн питиргоф тэӈимыръэнут мытрэгитэӈын	м э с ӄ э эӄын _ ы н к ы _ м ы т р а т в а а ’ _ д и а н а н а _ т р а н к а л р о в ӈ ы н а т _ л ы г эн _ п и т и р г о ф _ т э ӈ и м ыръэнут _ м ы т р э г и т э ӈ ы н _
лыгэнъым ынӄэн майӈынымэӈын чанктпитирбурк транкалровӈын	л ы г э н ъ ы м _ ы н ӄ э н  _ м а й ӈ ы н ы м э ӈ ы н _ ч а н к т п и т и р б у р к _ т р а н к а л р о в ӈ ы н _
ынкы ткэлиткугъэк тъэргииӈит	ы н к ы _ т к э л и т к у г ъ э к _ т ъ э р г и и ӈ и т _
ынӄоры vиталинанэн отпучк ратвагъа мури кынмал мытрэлӄытгъэ аӈӄагты мытрайъоӈын	ы н ӄ о ры _ v и т а л и н а н э н _ о т п у ч к _ р а т в а гъа _ м у р и _ к ы н мал _ м ы т р э л ӄ ы т г ъ э _ а ӈ ӄ а г т ы  _ м ы т р а й ъ о ӈ ы н _
ляричанэн ы’лгытумгыӄэй žэня мытрай мытрайъоӈын ынкы мытранымытвагъа тъэр нидэлят	л я р и ч а н э н _ ы ’ л г ы т у м г ы ӄ э й _ ž э н я _ м ы т р а й _ м ы т р а й ъ о ӈ ы н _ ы н к ы _ м ы т р а н ы м ы т в а г ъ а _ т ъ э р _ н и д э л я т _
ынӄоры нэмэ питирэты мытрэлӄытгъэ	ы н ӄ о ры _ н эмэ _ п и т и р э т ы _ м ы т р э л ӄ ы т г ъ э _
мэсӄээӄын ынкы мытратвагъа	м э с ӄ э эӄын _ ы н к ы _ м ы т р а т в а г ъ а  _
нэмэ мачквагты мачквайпы въаӈэты въаӈгыпы элгыӄанъявэты ынкъам ӈутрилы нэмэ мытрарагтыа’	н эмэ _ м а ч к в а г т ы _ м а ч к в а й п ы _ в ъ а ӈ э т ы _ в ъ а ӈ г ы п ы _ э л г ы ӄ а н ъ я в э т ы _ ынкъам _ ӈ у т р и л ы  _ н э м э _ м ы т р а р а г т ы а ’ _
ӄэлюӄы’м диананэн энмэч калеткогыргын рэпкиргъэ	ӄ э л ю ӄ ы ’ м  _ д и а н а н э н _ э н м э ч _ к а л е т к о г ы ргын _ р э п к и ргъэ _
опопы мачынан мачынан нымачпэляткоа’н кэлиткук	о попы _ м ачынан _ м а ч ынан _ н ы м а ч п э л я т к о а ’ н _ к э л и т к у к _
ытлён нылгинытэӈкэлиткуӄин аммытлыӈ аммытлыӈбалтэ ӄонпы нинэпириӄинэт	ы т л ён _ н ы л г и н ы т э ӈ к э л и т к у ӄ ин _ а м м ы т л ы ӈ _ а м м ы т л ы ӈ б а л т э _ ӄ о н пы _ н и н э п и р иӄинэт _
ынӄэ мачынан нымэч нымачпэлятъан	ы н ӄ э _ м а ч ынан _ н ы м э ч _ н ы м а ч п э л я т ъ а н _
пэтле рэркылегнинэт кэлиткутумгыт	п э т л е  _ р э р к ы л е г н и н э т _ к э л и т к у т у мгыт _
ытръэч	ы т р ъэч _
айвэ гым пытӄайвэ тыетгъэк элгыӄанъяквыпы	а й вэ _ г ы м _ п ы т ӄ а й в э _ т ы е т г ъ э к _ э л г ы ӄ а н ъ я к в ы п ы _
ынкы	ы н к ы _
нывилыткуйгыт	н ы в и л ы т к у й г ы т _
ынкы ы’твиӈын гэетлин	ы н к ы _ ы ’ т в и ӈ ы н _ г э е т л и н _
вэлыткорак имыръэнутэ ныйылӄин	в э л ы т корак _ и м ы р ъ э н у т э _ н ы й ы л ӄ и н _
э’льэлетэ	э ’ л ь э л е т э _
ынкъам мытъенмык элгыӄанъяквыпы пэтле	ынкъам _ м ы т ъ е н м ык _ э л г ы ӄ а н ъ я к в ы п ы _ п э т л е  _
ӄлявыл мургин гатапаспортӈылен	ӄ л я выл _ м у р г и н _ г а т а п а с п о р т ӈ ы л е н _
ынкъам айвэ ымъылёӈэт тытъымӄупӄэтгъэк	ынкъам _ а й в э _ ы м ъ ы л ёӈэт _ т ы т ъ ы м ӄ у п ӄ э т г ъ э к _
ымъысоӈэт ымъылёӈэт тыйылӄэтгъэк	ы м ъ ы с о ӈ э т _ ы м ъ ы л ёӈэт _ т ы й ы л ӄ э т г ъ э к _
люутэ пъомпъоӈыт тыльунэт лгинымкыӄин	л ю у т э _ п ъ о м п ъ о ӈ ы т _ т ы л ь у нэт _ л г и н ы м к ы ӄ и н _
ынкъам тыгэсеӈӈонат	ынкъам _ т ы г э с е ӈ ӈ о н а т _
ынӄэн тынтыяатгъан а’нэлёвыргын ынӄо	ы н ӄ эн _ т ы н т ы я а т г ъ а н _ а ’ н э л ё в ы р г ы н _ ы н ӄ о _
тръилегъэ пъомпъоӈэты	т р ъ и л е г ъ э _ п ъ о м п ъ о ӈ э т ы _
тыгынтэгъэ пъомпъоӈэты	т ы г ы н т э г ъ э _ п ъ о м п ъ о ӈ э т ы _
ынӄо мрэнэ гым нагтатэвым	ы н ӄ о _ м р э н э _ г ы м _ н а г т а т э в ы м _
гым трагтыгъак	г ым _ т р а г т ыгъак _
ярагты нагтатгыт	я р а г ты _ н а г т а т г ы т _
ии ынкъам пъомпъоӈытэ тынмигчирэвнэт	и и _ ы н к ъам _ п ъ о м п ъ о ӈ ы т э _ т ы н м и г ч и р э в н э т _
тынититынэт игыт	т ы н и т и т ы н э т _ и г ы т _
тынчикунэт	т ы н ч и к у н э т _
тынчикунэт	т ы н ч и к у н э т _
тынчикунэт	т ы н ч и к у н э т _
и тынититынэт ынкъам игыт вай ӈан ӈоонӄэн	и _ т ы н и т и т ы н э т _ ынкъам _ и г ы т _ в а й  _ ӈ а н _ ӈ о онӄэн _
гым чит омваамвырочгэты тъанэлёсӄэвык яраг рымагтэты	г ым _ ч и т _ о м в а а м в ы р о ч г э т ы _ т ъ а н э л ё с ӄ э в ы к _ я р а г _ р ы м а г тэты _
ынӄо люут ынкы тыльунэт пъомпъоӈыт нымкыӄин	ы н ӄ о _ л ю у т _ ы н к ы _ т ы л ь у нэт _ п ъ о м п ъ о ӈ ы т _ н ы м к ы ӄин _
ынкъам тыгэчеӈӈонат	ынкъам _ т ы г э ч е ӈ ӈ о н а т _
пууръу тытаӈынтыяатын а’нэлёгыргын	п у уръу _ т ы т а ӈ ы н т ы я а т ы н _ а ’ н э л ё г ы р г ы н _
ынкъам пъомпъоӈыт тыгисинэт	ынкъам _ п ъ о м п ъ о ӈ ы т _ т ы г и с и н э т _
наӄам ныгтымранатӄэн	н а ӄам _ н ы г т ы м р а н а т ӄ э н _
мрэнэ нэнугым	м р э н э _ н э н у г ы м _
и ынкы трагтыгъак	и _ ы н к ы _ т р а г т ыгъак _
ытръэч	ы т р ъэч _
гым ынкъам палина гапъомпъоӈӈытаморэ	г ым _ ы н к ъам _ п а л и н а _ г а п ъ о м п ъ о ӈ ӈ ы т а м о р э _
наӄам нилетӄин чама	н а ӄам _ н и л е т ӄин _ ч а м а _
вэнлыги мытэквэнмыкъым	в э н л ы ги _ м ы т э к в э н м ы к ъ ы м _
чама ныкитэ ныкытийгатӄэн ныч нымассьачаӈкытийгатӄэн ынкъам тэӈуйӈэ эмрэнкэ	ч ама _ н ы к и т э _ н ы к ы т и й г а т ӄ э н _ н ы ч _ н ы м а с с ь а ч а ӈ к ы т и й г а т ӄ э н _ ынкъам _ т э ӈ у й ӈэ _ э м р э н к э _
ынкы мытгисинэтэ пъомпъоӈытъым ынкъам лемӄут	ы н к ы _ м ы т г и с и н э т э _ п ъ о м п ъ о ӈ ы т ъ ы м _ ынкъам _ л е м ӄ у т _
лемӄут	л е м ӄ у т _
ынӄо ынӄо мури мытрагтымык	ы н ӄ о _ ы н ӄ о _ м у р и _ м ы т р а г т ы м ы к _
нымӈылтэлӄэн ваӈӄарэмакэн куувэӈэ аӈӄальын	н ы м ӈ ы л т э л ӄэн _ в а ӈ ӄ а р э м а к э н _ к у у в э ӈ э _ а ӈ ӄ а л ь ы н _
нивӄинэ ӄол мытинмык нутэк гэткивмури магляльыморэ лгэсьасаӈвыясеэгатӄэн	н и в ӄ и н э _ ӄ о л _ м ы т и н м ы к _ н у т э к _ г э т к и в м у р и _ м а г л я л ь ы м о р э _ л г э с ь а с а ӈ в ы я с е э г а т ӄ э н _
ымыльо ӄол эргыръокы тылӄутгъэкъымэ рэмкын эвын норгымэглетӄэн	ы м ы л ь о _ ӄ о л _ э р г ы р ъ о к ы _ т ы л ӄ у т г ъ э к ъ ы м э _ р э м кын _ э в ы н _ н о р г ы м э г л е т ӄ э н _
чинитъыттъыгаканъёк рэмкыт ӄача энмэ нымигчирэтӄинэт	ч и н и т ъ ы т т ъ ы г а к а н ъ ё к _ р э м к ы т _ ӄ а ч а _ э н м э _ н ы м и г ч и р э т ӄ и н э т  _
нивигым мычейвыткугъэк китаӄуна момавгъак	н и в и гым _ м ы ч е й выткугъэк _ к и т а ӄ у н а _ м о м а в г ъ а к _
тыльугъэн ӄол каӈэтвальын орвыкъым	т ы л ь у г ъ эн _ ӄ о л _ к а ӈ э т в а л ь ы н _ о р в ы к ъ ы м _
ниви тыӈойӈыкыплыгъан	н и в и _ т ы ӈ о й ӈ ы к ы п л ы г ъ а н _
нивигым этаны гымнин ынӄэнэ пэнин ӄуӈычгытэйкэвытумгын	н и в и гым _ э таны _ г ы м нин _ ы н ӄ э н э _ п э н ин _ ӄ у ӈ ы ч г ы т э й к э в ы т у м г ы н  _
читъым нэрмэйгым гым нэрмэчитивым ваӈӄарэмак тэйкэвык	ч и т ъ ы м _ н э р м э й г ы м _ г ы м _ н э р м э ч и т и в ы м _ в а ӈ ӄ а р э мак _ т э й к э в ы к _
тыгитэгъэн ӄытлыги ӄырым ӄытлыги эмнуӈыльын пэгытту	т ы г и т эгъэн _ ӄ ы т л ы ги _ ӄ ы р ым _ ӄ ы т л ы ги _ э м н у ӈ ы л ь ы н _ п э г ы т т у _
чит тыгынтэвыркынъым инэпирии’	ч и т _ т ы г ы н т э в ы р к ы н ъ ы м _ и н э п и р и и ’ _
мыттэйкэвмыкъым	м ы т т э й к э в м ы к ъ ы м _
лымынкыри энанватъевгъэ ымы инэтрилгъи	л ы м ы н к ы р и  _ э н а н в а т ъ е в г ъ э _ ы м ы  _ и н э т р и л г ъ и _
тагрытыляма муриӈэ	т а г р ы т ы л я м а _ м у р и ӈ э _
ынӄэнэ гым ипэ кымъыӈэнэ нэнатарычваӈӄэн ӄэлюӄ ӈээккэӄэйивым еп	ы н ӄ э н э _ г ы м _ и п э  _ к ы м ъ ы ӈ э нэ _ н э н а т а р ы ч в а ӈ ӄ э н _ ӄ э л ю ӄ _ ӈ э э к к э ӄ э й и в ы м _ е п _
нэнатарычваӈӄээтъымэ	н э н а т а р ы ч в а ӈ ӄ э э т ъ ы м э _
нинэйылӄин гым каарачыко вальэвым ва ынӄэн нэналпынрыӄэн кэгынмычыку	н и н э й ы л ӄ и н _ г ы м _ к а а р а чыко _ в а л ь э в ы м _ в а _ ы н ӄ э н  _ н э н а л п ы нрыӄэн _ к э г ы н м ы ч ы к у _
ытръэч ынӄэнэ ӄол тынтынэт тыгитэнэт ынин кэгынмытъым	ы т р ъэч _ ы н ӄ э н э _ ӄ о л _ т ы н т ы н э т _ т ы г и т э н э т _ ы н и н _ к э г ы н м ы т ъ ы м _
элёльыӈӈоа’тэ аръаля гагты	э л ё л ь ы ӈ ӈ о а ’ т э _ а р ъ а л я _ г а г т ы _
ынӄэн эӄылпэӈэ тыпиринэт ынӈин	ы н ӄ эн _ э ӄ ы л п э ӈ э _ т ы п и р и н э т _ ы н ӈ и н  _
тынинтысӄивнэт ӈоонрэ каарачыкойпы	т ы н и н т ы с ӄ и в н э т _ ӈ о о н р э _ к а а р а ч ы к о й п ы _
ӈоонӄо ы’лык иргъэт	ӈ о о н ӄ о _ ы ’ л ы к _ и р г ъ э т _
ынӄорыӈэ гамӈылтэтлен апаӄайына	ы н ӄ о р ы ӈ э _ г а м ӈ ы лтэтлен _ а п а ӄ а й ы н а _
ытчаяӄэйъым гымнинэ эпэӄэйыну нинъэйӈэвивым	ы т ч а я ӄ э й ъ ы м _ г ы м н и н э _ э п э ӄ э й ы н у _ н и н ъ э й ӈ э в и в ы м _
ытльэ гымыкытльэн ынӄэнэ ынпыччакит ынпычьын чакыгэт	ы т л ь э _ г ы м ы к ы т л ь э н _ ы н ӄ э н э _ ы н п ы ч ч а к и т _ ы н п ы ч ь ы н _ ч а к ы г эт _
гымнан эпэӄэйыну нинъэйӈэвивым ынӄэн ынӈинэ	г ы м нан _ э п э ӄ э й ы н у _ н и н ъ э й ӈ э в и в ы м _ ы н ӄ э н  _ ы н ӈ и н э _
ыныкэккэлӄылин ӈэв ӈэвъэнйыръын ӈэ ӈэвъэнъым ынӄэн кымъыӈэ	ы н ы к э к к э л ӄ ы л и н _ ӈ э в _ ӈ э в ъ э н й ы р ъын _ ӈ э _ ӈ э в ъ э н ъ ы м _ ы н ӄ э н  _ к ы м ъ ы ӈ э _
ынанъымэ ив гэрэӄылин ӈээккэӄэй арычвокыльин	ы н а н ъ ы м э _ и в _ г э р э ӄ ы л и н _ ӈ э э к к эӄэй _ а р ы ч в о к ы л ь и н _
ивнин	и внин _
мачынан ынӄэн э’нӄэыркынъым ынӈэ ынӈэ рычвойвот энтивкэ	м а чынан _ ы н ӄ э н  _ э ’ н ӄ э ы р к ы н ъ ы м _ ы н ӈ э _ ы н ӈ э _ р ы ч в о й в о т _ э н т и в к э _
ытръэч	ы т р ъэч _
ынӄэн ынӈин тпаак рычвок	ы н ӄ эн _ ы н ӈ ин _ т п а а к _ р ы ч в о к _
лгинъыръыӄинэт чавчыват	л г и н ъ ы р ъ ы ӄ и н э т _ ч а в ч ы в а т _
энмэн ръоравэнвыеквэ нылеӄинэт	э нмэн _ р ъ о р а в э н в ы е к в э _ н ы л е ӄ и н э т  _
мэвын ынӈин мэйӈыльын нъывинвэтгъэн	м э в ын _ ы н ӈин _ м э й ӈ ы л ь ы н _ н ъ ы в и н в э т г ъ э н _
гатваленат ӈэвъэнйыръын ынкъам ӄлявыл	г а т в а л е н а т _ ӈ э в ъ э н й ы р ъын _ ы нкъам _ ӄ л я выл _
ӈэвъэнйыръын ынкъам ӄлявыл гатваленат	ӈ э в ъ э н й ыръын _ ы нкъам _ ӄ л я выл _ г а т в а л е н а т _
ӈэлвыл ыргин уйӈэ гэнъэтлин	ӈ э л в ы л _ ы р г и н  _ у й ӈ э _ г э н ъэтлин _
ынан ӄлявыля ӈэвъэнйыръын ивнин	ы н а н _ ӄ л я в ы л я _ ӈ э в ъ э н й ы р ъын _ и в н ин _
нэльунэт гэкэӈыльыт	н э л ь у н э т _ г э к э ӈ ы л ь ы т _
ӄлявыля ивнин	ӄ л я в ы л я _ и в н ин _
ӄыӄымъяркыплыткы ӄыӄымъяркыплятгэ	ӄ ы ӄ ы м ъ я р к ы п л ы т к ы _ ӄ ы ӄ ы м ъ я р к ы п л я т г э _
ӈэвъэн ӈэвъэнэ чайкокат энаръэнан энаръэнэнат ӄымъяркыплятгъэ	ӈ э в ъ эн _ ӈ э въэнэ _ ч а й к о к а т _ э н а р ъ э н а н _ э н а р ъ э н э н а т _ ӄ ы м ъ я р к ы п л я т г ъ э _
эӄылпэ рылгъат	э ӄ ы л п э _ р ы л г ъ а т  _
эӄылпэ чайкок нэнититгъэн увиэ’т эӄылпэ эна эни энаръэнат ӄымъяркыплятгъат	э ӄ ы л п э _ ч а й к о к _ н э н и т и т г ъ э н _ у в и э ’ т _ э ӄ ы л п э _ э н а _ э н и _ э н а р ъ э н а т _ ӄ ы м ъ я р к ы п л я т г ъ а т _
етгъэт гэкэӈыльыт рылгъат	е т г ъ э т _ г э к э ӈ ы л ь ы т _ р ы л г ъ а т  _
нивӄинэт	н и в ӄ и н эт _
тэӈуйӈэ мури ныӈо’морэ	т э ӈ у йӈэ _ м у р и _ н ы ӈ о ’ м о р э _
ныӈо’морэ	н ы ӈ о ’ м о р э _
гарачайонленат рэмкыльыт	г а р а ч а й о н л е н а т _ р э м к ы л ь ы т _
ӄлявыля ивнин ӈэвъэн	ӄ л я в ы л я _ и в н ин _ ӈ эвъэн _
ӄувиги	ӄ у в и г и _
ӈытогъэ ӈэвъэнйыръын ынкы иквъи	ӈ ы тогъэ _ ӈ э в ъ э н й ы р ъын _ ы н к ы _ и к въи _
чайкокаӄагэгыт ӄититги	ч а й к о к а ӄ а г э г ы т _ ӄ и т и т г и _
тъэче ӈирэче ивнин ӈыроча ивнин	т ъ э ч е _ ӈ и р э ч е _ и в н ин _ ӈ ы р о ч а _ и в н ин _
чайкокаӄагэгыт ӄититги	ч а й к о к а ӄ а г э г ы т _ ӄ и т и т г и _
люут рэннин кукэӈы лгинытгылӄин	л ю у т _ р э н н и н _ к у к эӈы _ л г и н ы т г ы л ӄ и н _
иквъэтэ	и к в ъ э т э _
миӈкыри тури ынӈин чайпаттык	м иӈкыри _ т у р и _ ы нӈин _ ч а й п а т т ы к _
нивӄин	н и вӄин _
ынӄэн мургин кукэӄэй чинит нычайпатӄэн	ы н ӄ эн _ м у ргин _ к у к э ӄ э й _ ч и н ит _ н ы ч а й п а т ӄ э н _
рэмкэ налгээнъатэвгъан кукэӈы	р э м к э _ н а л г э э н ъ а т э в г ъ а н _ к у к эӈы _
ӄлявыл нивӄин	ӄ л я выл _ н и в ӄ и н _
нэмыӄэй мургин яаёлӄыл	н э м ы ӄэй _ м у р г и н _ я а ё л ӄ ы л _
мургин яаёлӄыл	м у р г ин _ я а ё л ӄ ы л _
рэмкэ ивнин	р э м к э _ и в н ин _
ым ымыльэты ӈэлвыл трэ мытрэйылгыт	ы м _ ы м ы л ь э т ы _ ӈ э л в ы л _ т р э _ м ы т р э й ы л г ы т _
нэйылгъэн кукэӈы эквэтгъэт рэмкыльыт	н э й ы л г ъ эн _ к у к эӈы _ э к в э т г ъ э т  _ р э м к ы л ь ы т _
тумгэ ивнин ӈэвъэнйы ӈэвъэн	т у м г э _ и в н ин _ ӈ э в ъ э н й ы _ ӈ э в ъ э н _
эӄылпэ мынръэйвэнмык	э ӄ ы л п э _ м ы н р ъ э й в э н м ы к _
эӄылпэ гэли гэръэйвэтлинэт ялгытгъат тэӈэӄылпэ	э ӄ ы л п э _ г э л и _ г э р ъ э й в э т л и н э т _ я л г ы т г ъ а т _ т э ӈ э ӄ ы л п э _
янот ръэтъеквэ мытлемыкъым	я н о т _ р ъ э т ъ е к вэ _ м ы т л е м ы к ъ ы м _
ынӄо гытгыпэлгыкагыргын мытъиргъэнъым	ы н ӄ о _ г ы т г ы п э л г ы к а г ы р г ы н _ м ы т ъ и р г ъ э н ъ ы м _
ынӄо мыт омкычыкойпы мытлемыкъым ынӄо мытйынрысӄанмыкъым	ы н ӄ о _ м ы т _ о м к ы ч ыкойпы _ м ы т л е м ы к ъ ы м _ ы н ӄ о _ м ы т й ы н р ы с ӄ а н м ы к ъ ы м _
ӈагтагнэты мытлемык йынрысӄыткыната	ӈ а г т а г н э т ы _ м ы т л е м ы к _ й ы н р ы с ӄ ы т к ы н а т а _
ынӄо мытӈэйыттэнмык янот йиӈ ӈайгыточгыткок мытчайомык ӈайгытолыӈкы	ы н ӄ о _ м ы т ӈ э й ы т т э н м ы к _ я н о т _ й и ӈ _ ӈ а й г ы т о ч г ы т к о к  _ м ы т ч а й о м ы к _ ӈ а й г ы т о л ы ӈ к ы _
ынӄо нэмэ мытӈэйыттэнмык	ы н ӄ о _ н эмэ _ м ы т ӈ э й ы т т э н м ы к _
таӈлымынӄо ӈай ӈай ӈайгыпы мытле ӈайыткыната мытлейвымык	т а ӈ л ы мынӄо _ ӈ а й _ ӈ а й _ ӈ а й г ы п ы  _ м ы т л е _ ӈ а й ы т к ы н а т а _ м ы т л е й в ы м ы к _
ынӄо мытивыт мыткэӈкэленмык мытчайпанмыкы	ы н ӄ о _ м ы т и в ы т _ м ы т к э ӈ к э л е н м ы к _ м ы т ч а й п а н м ы к ы _
мытчайомыкъым и нэмэ мытпъугыркимык	м ы т ч а й о м ы к ъ ы м _ и _ н э м э _ м ы т п ъ у г ы р к и м ы к _
ынӄэн мыт	ы н ӄ эн _ м ы т _
и ралӄаӈынвы мытчайомык нэмэ	и _ р а л ӄ а ӈ ы н в ы _ м ы т ч а й о м ы к _ н э м э _
ынӄо нэмэ мыт гытгыпэлгыкагыргыт мытъиргъэн	ы н ӄ о _ н эмэ _ м ы т _ г ы т г ы п э л г ы к а г ы р г ы т _ м ы т ъ и р г ъ э н _
и гыр мытръэтпэнрымык и ынкы ковлёрвыӄай	и _ г ы р _ м ы т р ъ э т п э н р ы м ы к _ и _ ы н к ы _ к о в л ё р в ы ӄ а й _
и матачикля мытрагтымык	и _ м а т а ч и к л я _ м ы т р а г т ы м ы к _
нэрэнмык ӈаанӄоры рамайэты и мытрэсӄивмык	н э р э н м ы к _ ӈ а а н ӄ о р ы _ р а м а й э т ы _ и _ м ы т р э с ӄ и в м ы к _
ынӄо мытилгытэвмык и мытчаёмгомык и мыткалеткомгомык	ы н ӄ о _ м ы т и л г ы т э в м ы к _ и _ м ы т ч а ё м г о м ы к _ и _ м ы т к а л е т к о м г о м ы к _
ытръэч	ы т р ъэч _
ынйивӈэвэ мынпъоӈӈытамык	ы н й и в ӈ эвэ _ м ы н п ъ о ӈ ӈ ы т а м ы к _
ии	и и _
янотъым гым трачайогъа ынӄо мынпъоӈӈытама ӄэйвэ’м	я н о т ъ ы м _ г ы м _ т р а ч а й о г ъ а _ ы н ӄ о _ м ы н п ъ о ӈ ӈ ы т а м а _ ӄ э й в э ’ м _
