миӈкэтэ лымэвыт ваамъеквэъым лымэвыт аӈӄаеквэ нылеӄин магляльынъым	м и ӈ к э т э  _ л ы м э в ы т _ в а а м ъ е к в э ъ ы м _ л ы м э в ы т _ а ӈ ӄ а е к в э _ н ы л е ӄ ин _ м а г л я л ь ы н ъ ы м _
люут льунинэ элгъоравэтльан	л ю у т _ л ь у н и н э _ э л г ъ о р а в э т л ь а н _
йыӈэнинъым ченэтрагты танэн ынкыӈэ	й ы ӈ э н и н ъ ы м _ ч е н э т рагты _ т а н э н  _ ы н к ы ӈ э _
выткуӈэ чыкээквъиы’мэ	в ы т к у ӈ э _ ч ы к э э к в ъ и ы ’ м э _
пэнъёлгыткоӄэн ръэнут эты эчкимоч леӈытаӄ	п э н ъ ё л г ы т к о ӄ э н _ р ъ э нут _ э т ы _ э ч к и м о ч _ л е ӈ ы т а ӄ _
ынкы нэнаномаватӄэн	ы н к ы _ н э н а н о м а в а т ӄ э н _
нинэгитэӄин ръэмиӈкэкин ӈотӄэн о’равэтльан	н и н э г итэӄин _ р ъ э м и ӈ к э к и н _ ӈ о т ӄэн _ о ’ р а в э т л ь а н  _
игыт марэгына манэгран нанкалыроквъан уттынутэкэнэ чамаӈа ваамлыӈкы вальын	и г ы т _ м а р э г ы н а _ м а н э г р а н _ н а н к а л ы р о к в ъ а н _ у т т ы н у т э к э н э _ ч а м а ӈ а _ в а а м л ы ӈ кы _ в а л ь ы н _
валӄылыргытанӈын тинлылельынэ	в а л ӄ ы л ы р г ы т а н ӈ ы н _ т и н л ы л е л ь ы н э _
ынӄэнэ ръэнут нинэтэйкыӄин кэликэл юрэӄы’мэ	ы н ӄ э н э _ р ъ э нут _ н и н э т э й кыӄин _ к э л и к э л  _ ю р э ӄ ы ’ м э _
ӈаргыночьыт нинэтэнгыеӈӄээт миӈкыри вальыт	ӈ а р г ы н о ч ь ы т _ н и н э т э н г ы е ӈ ӄ э э т _ м и ӈ кыри _ в а л ь ы т _
вытку льунин ынӄэн игыт	в ы т ку _ л ь у нин _ ы н ӄ э н  _ и г ы т _
ытръэч	ы т р ъэч _
и’ныӈэ энмэна эн ынӄэн и’ны мэльыттъывытрынэ ӄынут гэгиинрэлин ӄынутэ гытъэвыльын гэймэвлин о’равэтльак	и ’ н ы ӈ э _ э н м э н а _ э н _ ы н ӄ э н  _ и ’ н ы _ м э л ь ы т т ъ ы в ы т р ы н э _ ӄ ы н у т _ г э г и и н р э л и н _ ӄ ы н у т э _ г ы т ъ э в ы л ь ы н  _ г э й м э в л и н _ о ’ р а в э т л ь а к _
ытръэч	ы т р ъэч _
ӄонпы нывичвэтчыӄивӄинэтъым ныманэванлясӄэвӄэнат	ӄ о н пы _ н ы в и ч в э т ч ы ӄ и в ӄ и н э т ъ ы м _ н ы м а н э в а н л я с ӄ э в ӄ э н а т _
ӄынвэт иран ирана нинэльуӄин чиниткин экыкv эймэвыльын ыныкагты’м	ӄ ы н в э т _ и р а н _ и р а н а _ н и н э л ь у ӄин _ ч и н и т к и н _ э к ы к v _ э й м э в ы л ь ы н _ ы н ы к а г т ы ’ м _
нъыръыйылӄыӈӈоӄэн ынӈин вай	н ъ ы р ъ ы й ы л ӄ ы ӈ ӈ о ӄ э н _ ы н ӈ и н  _ в а й  _
эккэтэ’м ынӈин ынӄэн нинэгитэӄинъым	э к к э т э ’ м _ ы н ӈ и н  _ ы н ӄ эн _ н и н э г и т э ӄ и н ъ ы м _
ӄынвэт ӄынвэт нытанӈыткоӈӈоӄэн	ӄ ы н в э т _ ӄ ы н в э т _ н ы т а н ӈ ы т к о ӈ ӈ о ӄ э н _
ыммэмы ӄэнаманэлпынрыгэ	ы м м э м ы _ ӄ э н а м а н э л п ы н р ы г э _
ынкы ӄээӄынъым мывичвысӄиквъэк	ы н к ы _ ӄ э э ӄ ы н ъ ы м _ м ы в и ч в ы с ӄ и к в ъ э к _
эээ ӄэлюӄы’м нэнаманэлпынрыӄэн	э э э _ ӄ э л ю ӄ ы ’ м  _ н э н а м а н э л п ы н р ы ӄ э н _
мургинэт нэмыӄэй ныетӄинэт ӈинӄэгти	м у р г и н э т _ н э м ы ӄ эй _ н ы е т ӄ и н э т  _ ӈ и н ӄ э г т и _
нэмыӄэй ныманэванлясӄэвӄэнат	н э м ы ӄэй _ н ы м а н э в а н л я с ӄ э в ӄ э н а т _
э’тки вай ӄээӄын мытылгирывичвэнӈыркын	э ’ тки _ в ай _ ӄ э э ӄ ы н _ м ы т ы л г и р ы в и ч в э н ӈ ы р к ы н _
ӄэлюӄы’м ытлыгэ нэнаманэлпынрыӄэнатэ амъянра наӄам	ӄ э л ю ӄ ы ’ м  _ ы т л ы г э _ н э н а м а н э л п ы н р ы ӄ э н а т э _ а м ъ я н ра _ н а ӄ ам _
ынӈинъымэ	ы н ӈ и н ъ ы м э _
нэмэ ын нэмэ ынӄэн ӈыро комната ныйъоӄэн	н эмэ _ ы н _ н э м э _ ы н ӄ эн _ ӈ ы р о _ к о м н а т а _ н ы й ъ о ӄэн _
ынпыӈэвӄэй кымъыӈэӄэйъымэ летынтагравнэн ытльаӄай лгитэленъепкинэ лыгэн лгиынпыӈэвӄэй аръаля	ы н п ы ӈ э в ӄэй _ к ы м ъ ы ӈ э ӄ э й ъ ы м э _ л е т ы н т а г р а в н э н _ ы т л ь а ӄ а й _ л г и т э л е н ъ е п к и н э _ л ы г эн _ л г и ы н п ы ӈ э в ӄ э й _ а р ъ а л я _
купрэткумуриӈэ ямгагытгыкъым рээн ӈоонӄо ваӈӄарэмак ӄача кынмаӈӄакъым	к у п р э т к у м у р и ӈ э _ я м г а г ы т г ы к ъ ы м _ р э э н _ ӈ о о н ӄ о _ в а ӈ ӄ а р э мак _ ӄача _ к ы н м а ӈ ӄ а к ъ ы м _
нэкэм вай ынӄоӈэ ваӈӄарэмараӄаеквэйпыӈэ таӈо’ра выквыткойӈыт ынӈин вэтляквыткойӈыт вальытъымэ	н э к э м  _ в а й  _ ы н ӄ о ӈ э _ в а ӈ ӄ а р э м а р а ӄ а е к в э й п ы ӈ э _ т а ӈ о ’ р а _ в ы к в ы т к о й ӈ ы т _ ы н ӈ и н  _ в э т л я к в ы т к о й ӈ ы т _ в а л ь ы т ъ ы м э _
нивӄинэ	н и в ӄ и н э _
ӈанӄаатъым ӄынут ӈанэ ӄытлыги тэленъепэ тылельытэ миӈкы имлетгынтэвыльыт ӄэлюӄы’мэ ӈанӄэ чит таӈымыльэтыӈа ӈотӄэн нутэнут мургин мимлычыку вальын	ӈ а н ӄ а а т ъ ы м _ ӄ ы н у т _ ӈ а н э _ ӄ ы т л ы ги _ т э л е н ъ е п э _ т ы л е л ь ы т э _ м и ӈ к ы _ и м л е т г ы н т э в ы л ь ы т _ ӄ э л ю ӄ ы ’ м э _ ӈ а н ӄ э _ ч и т _ т а ӈ ы м ы л ь э т ы ӈ а _ ӈ о т ӄэн _ н у т э н у т  _ м у ргин _ м и м л ы чыку _ в а л ь ы н _
ынкъамэ ынӄэна	ы н к ъ а м э _ ы н ӄ э н а _
ынӄэна	ы н ӄ э н а _
ынкы имлетыкъыма чит ӈутку мургынутэ вальыт камагӈалвыльыйӈытъыма	ы н к ы _ и м л е т ы к ъ ы м а _ ч и т _ ӈ у т ку _ м у р г ы н у т э _ в а л ь ы т _ к а м а г ӈ а л в ы л ь ы й ӈ ы т ъ ы м а _
игыт ӈан рынныт ынӄаатэ нутэкэ ръылӄычыку ръылӄывээмык рээн ныльуӄинэтэ	и г ы т _ ӈ а н  _ р ы н н ы т _ ы н ӄ а а т э _ н у т э к э _ р ъ ы л ӄ ы ч ы к у _ р ъ ы л ӄ ы в э э м ы к _ р э э н _ н ы л ь у ӄ и н э т э _
чит нымкыӄин колё камагтэ	ч и т _ н ы м к ы ӄин _ к о л ё _ к а м а г т э _
ынкъамэ ынӄэнатаӈа энмэна о’равэт о’ о’равэтрамкына гэегтэллин энмэна	ы н к ъ а м э _ ы н ӄ э н а т а ӈ а _ э н м э н а _ о ’ р а в э т _ о ’ _ о ’ р а в э т р а м к ы н а _ г э е г т э л л и н _ э н м э н а _
ӄол мыгнэнэнэльынъымэ мэйӈынэнэнэтэӈ нэнатратӄэн аӈӄы нэналпынрыӄэнъымэ	ӄ о л _ м ы г н э н э н э л ь ы н ъ ы м э _ м э й ӈ ы н э н э н э т э ӈ _ н э н а т р а т ӄ э н _ а ӈ ӄ ы _ н э н а л п ы н р ы ӄ э н ъ ы м э _
амынан рыгнуннин нанӈэнчьан нэнэныӈ	а м ы н а н _ р ы г н у н н и н _ н а н ӈ э н ч ь а н _ н э н э н ы ӈ _
къама мимлык нэмэ пэлӄынтэттылеъи’м къам иултиӈэгчыкыквальынэ ръэвинэ ы’мйиквин ынӄэнэ амылӄыквальын ынкы гамылӄыпэлятлена ръэв	к ъ а м а _ м и м л ы к _ н э м э _ п э л ӄ ы н т э т т ы л е ъ и ’ м _ к ъ а м _ и у л т и ӈ э г ч ы к ы к в а л ь ы н э _ р ъ э в и н э _ ы ’ м й и к в и н _ ы н ӄ э н э _ а м ы л ӄ ы к в а л ь ы н _ ы н к ы _ г а м ы л ӄ ы п э л я т л е н а _ р ъ э в _
ынӄэн нэмэ мимыл гэквэтлин гэтэлпылин аӈӄакэн	ы н ӄ эн _ н э м э _ м и м ы л  _ г э к в э тлин _ г э т э л п ы л и н _ а ӈ ӄ а к э н  _
льэлеӈръукэ тэкэм ӄуульэтык ӈутри наймыӄаат энмыгэӈэтыӈа	л ь э л е ӈ р ъ у к э _ т э к э м _ ӄ у у л ь э т ы к _ ӈ у т р и  _ н а й м ы ӄ а а т _ э н м ы г э ӈ э т ы ӈ а _
ковлёрвоор ковлёрвыткольын танӈынотайпы етыльын	к о в л ё р в о о р _ к о в л ё р в ы т к о л ь ы н _ т а н ӈ ы н о т а й п ы _ е т ы л ь ы н _
еп инъыӈӄач гатымӈэвлен тагмынгытчьэты тыликъым	е п _ и н ъ ы ӈ ӄ а ч _ г а т ы м ӈ э в л е н _ т а г м ы н г ы т ч ь э т ы _ т ы л и к ъ ы м _
люутэ вулӄытвикэ ӈэръамытлыӈчьэты галякэ очочаӈа заатеxника инъэйӈэквъи энавэтгавъёлгыткоэ’ иквъиӈа	л ю у т э _ в у л ӄ ы т в и к э _ ӈ э р ъ а м ы т л ы ӈ ч ь э т ы _ г а л я к э _ о ч о ч а ӈ а _ з а а т е x н и к а _ и н ъ э й ӈ э к в ъ и _ э н а в э т г а в ъ ё л г ы т к о э ’ _ и к в ъ и ӈ а _
еп гынмыл инъэ ковлёрвоор гатымӈэвленъыма	е п _ г ы н м ы л _ и н ъ э _ к о в л ё р в о о р _ г а т ы м ӈ э в л е н ъ ы м а _
льу нэналвавморэ	л ь у _ н э н а л в а в м о р э _
э’ми таӈтымӈэквъэ	э ’ м и _ т а ӈ т ы м ӈ э к в ъ э _
энмэч волӄытвэӈӈо вулӄытвигъим	э н м э ч _ в о л ӄ ы т в э ӈ ӈ о _ в у л ӄ ы т в и г ъ и м _
ӄорагынрэтыльыт вэчьыма нъетынэтэ мынъумэкэнмыкъым вэнратынво	ӄ о р а г ы н р э т ы л ь ы т  _ в э ч ь ы м а _ н ъ е т ы н э т э _ м ы н ъ у м э к э н м ы к ъ ы м _ в э н р а т ы н в о _
э’йӈэвыткумури энарэрык	э ’ й ӈ э в ы т к у м у р и _ э н а р э р ы к _
пэтле тылыгавэръэпыгъакъыма	п э т л е  _ т ы л ы г а в э р ъ э п ы г ъ а к ъ ы м а _
ӄорыӈа э’ми епӈа ӄуттиӈа нъатчаӄаат о’равэтльат	ӄ о р ы ӈ а _ э ’ м и _ е п ӈ а _ ӄ у т т и ӈ а _ н ъ а т ч а ӄ а а т _ о ’ р а в э т л ь а т _
мури гэтумгинэтэ ӈуткэтэ мытвинвытэгнэнмык айвачваамлыӈата чама рочгэты	м у ри _ г э т у м г и н э т э  _ ӈ у т к э т э  _ м ы т в и н в ы т э г н э н м ы к _ а й в а ч в а а м л ы ӈ а т а _ ч а м а _ р о ч г э т ы  _
ӄорыӈа вай ынкы рочгатама ваамлыӈата йынрытчигэ йынрыгэӈытко мытвинвытэгнэннэтэ	ӄ о р ы ӈ а _ в а й  _ ы н к ы _ р о ч г а т а м а _ в а а м л ы ӈ а т а _ й ы н р ы т ч и г э _ й ы н р ы г э ӈ ы т к о _ м ы т в и н в ы т э г н э н н э т э _
ваам эвычагты элӄылинытык айвачыӈӄач уйӈэ ръэт лёӈръэтатыльын	в а а м _ э в ы ч а г т ы _ э л ӄ ы л и н ы т ы к _ а й в а ч ы ӈ ӄ а ч _ у й ӈ э _ р ъ э т _ л ё ӈ р ъ э т а т ы л ь ы н _
ӈоонрэ лм айгысӄыӈӄачьым лымынкыри галгиръэтатлялен	ӈ о о нрэ _ л м _ а й г ы с ӄ ы ӈ ӄ а ч ь ы м _ л ы м ы н к ы р и  _ г а л г и р ъ э т а т л я л е н _
наӄам ээк нывитъытэлпыӄин	н а ӄам _ э э к _ н ы в и т ъ ы т э л п ы ӄ и н _
пэлӄынтэнмык визьдикотетыӈ	п э л ӄ ы н т э н м ы к _ в и з ь д и к о т е т ы ӈ _
энмыгэӈкы нытваӄаат	э н м ы г э ӈ кы _ н ы т в а ӄ а а т _
гырголягты наакатваӄаат	г ы р г о лягты _ н а а к а т в а ӄ а а т _
ныӈыръатваӄаат танӈыта	н ы ӈ ы р ъ а т в а ӄ а а т _ т а н ӈ ы т а _
миӈкыри мынинмыкъыма	м иӈкыри _ м ы н и н м ы к ъ ы м а _
тивын очоча	т и в ын _ о ч о ч а _
этъопэл ӈоонрэ айгыпы мынлельэнмык	э т ъ о п эл _ ӈ о о н р э _ а й г ы п ы _ м ы н л е л ь э н м ы к _
миӈкы винвыт эвын мытрайъоӈына мытрантымӈэвӈӈоӈын мынкынпыткольатыӈӈомыкъым	м и ӈ к ы _ в и н в ы т _ э в ы н _ м ы т р а й ъ о ӈ ы н а _ м ы т р а н т ы м ӈ э в ӈ ӈ о ӈ ын _ м ы н к ы н п ы т к о л ь а т ы ӈ ӈ о м ы к ъ ы м _
лгиэ’ӄээ’вкы вальын танӈочочьым тиквъэна	л г и э ’ ӄ э э ’ в к ы _ в а л ь ы н _ т а н ӈ о ч о ч ь ы м _ т и к в ъ э н а _
опопыӈа торгынан чинит ӄэнарэрыркынэтык йыӄӄэй ралмалявӈытык гымнан рэӄын ивык	о п о п ы ӈ а _ т о р г ы нан _ ч инит _ ӄ э н а р э р ы р к ы н э т ы к _ й ы ӄ ӄ э й _ р а л м а л я в ӈ ы т ы к _ г ы м н а н _ р э ӄ ы н  _ и в ы к _
ӄээӄын авъеткынка вэтчатвагъэм	ӄ э э ӄын _ а в ъ е т кынка _ в э т ч а т в а г ъ э м _
иквъиы’ма	и к в ъ и ы ’ м а _
ынӈин ӄыныгйивэтыркын миӈкыри нылеркын	ы н ӈ ин _ ӄ ы н ы г й и в э т ы р к ы н _ м и ӈ кыри _ н ы л е р к ы н _
ӄээӄын эвычагты айгыпы ӈэнри ваамъеквэ ӄойвыткыната тарӄойвыткыната мытлельэнмыкъым	ӄ э э ӄын _ э в ы ч а г т ы _ а й г ы п ы _ ӈ э н р и  _ в а а м ъ е к вэ _ ӄ о й в ы т к ы н а т а _ т а р ӄ о й в ы т к ы н а т а _ м ы т л е л ь э н м ы к ъ ы м _
чейвэ тъёпатын каӈкачгыргын	ч е й в э _ т ъ ё п а т ы н _ к а ӈ к а ч г ы р г ы н _
тэнкаӈкачгыргыкъыма туркэӈкэлетэ вээмӄэйчыку ачымъытъымыёлгычыкоеквэ мытляӈӈомыкъым тотръэт мытйъогъан	т э н к а ӈ к а ч г ы р г ы к ъ ы м а _ т у р к э ӈ к э л е т э _ в э э м ӄ э й ч ы к у _ а ч ы м ъ ы т ъ ы м ы ё л г ы ч ы к о е к в э _ м ы т л я ӈ ӈ о м ы к ъ ы м _ т о т р ъ э т _ м ы т й ъ о г ъ а н _
ынӄэн лыгэн ръэт мытыркылегъэнъым	ы н ӄ эн _ л ы г эн _ р ъ э т _ м ы т ы р к ы л е г ъ э н ъ ы м _
люут ӈэраӄычьэты ныкитэ мытынрынгиивын ковлёрвоор	л ю у т _ ӈ э р а ӄ ы ч ьэты _ н ы к и т э _ м ы т ы н р ы н г и и в ы н _ к о в л ё р в о о р _
наӄам ковлёрвыткольын галгэмытӄыталпыӈӈоленъым	н а ӄам _ к о в л ё р в ы т к о л ь ы н _ г а л г э м ы т ӄ ы т а л п ы ӈ ӈ о л е н ъ ы м _
ръэнут	р ъ энут _
вылгыкирзовыйчапокльынъыма эвтэ дžинчыӄонагыльын эвыр тэӈэвытӄэй тэгнъыӄэвъяӈӈогъан ыныки нъымытӄытэлпыгъан гаймаӈэн нъыӄитывъигъэн	в ы л г ы к и р з о в ы й ч а п о к л ь ы н ъ ы м а _ э в т э _ д ž и н ч ы ӄ о н а г ы л ь ы н _ э в ы р _ т э ӈ э в ы т ӄ э й _ т э г н ъ ы ӄ э в ъ я ӈ ӈ о г ъ а н _ ы н ы к и _ н ъ ы м ы т ӄ ы т э л п ы г ъ а н _ г а й м а ӈ э н _ н ъ ы ӄ и т ы в ъ и г ъ э н _
ытръэч	ы т р ъэч _
лыгъоравэтльана ӈавтыӈгъэ мачквичкакъым тэгнилгыӄин ӈэвысӄэт	л ы г ъ о р а в э т л ь а н а _ ӈ а в т ы ӈгъэ _ м а ч к в и ч к а к ъ ы м _ т э г н и л г ыӄин _ ӈ э в ысӄэт _
ынӄорыӈа ӄолетъылёӈа нэмэ чукоткагты етгъиы’м	ы н ӄ о р ы ӈ а _ ӄ о л е т ъ ы л ё ӈ а _ н э м э _ ч у к о т к а г т ы _ е т г ъ и ы ’ м _
игыт намӈылёгъан тумгэ	и г ы т _ н а м ӈ ы л ё г ъ ан _ т у м г э _
ы’мто гынин ӈэвъэн миӈкэмил вальын	ы ’ м т о  _ г ынин _ ӈ эвъэн _ м и ӈ к э м и л _ в а л ь ы н _
ии ытлён ынръам черитӄыльуӈэ	и и _ ы т л ён _ ы н р ъ а м _ ч е р и т ӄ ы л ь у ӈ э _
ӄонпы нилгытэвӄинэ	ӄ о н пы _ н и л г ы т э в ӄ и н э _
турыгъевкы ынкъам вулӄытвик ӄонпы нилгытэвӄин	т у р ы г ъ е вкы _ ы нкъам _ в у л ӄытвик _ ӄ о н пы _ н и л г ы т э в ӄ и н _
ӄэлёӄы’м эмнуӈкы гым гъурэтигымэ	ӄ э л ё ӄ ы ’ м  _ э м н уӈкы _ г ы м _ г ъ у р э т и г ы м э _
ытлыгыт ытльат ынӄэнэ нутэвги омрыквытгавыт	ы т л ы г ы т _ ы т л ь а т _ ы н ӄ э н э _ н у т э в г и _ о м р ы к в ы т г а в ы т _
нылгиныӈинӄинэ гаккантолен ынпычьын гымнин ынинэльын ынӄэнэ котыгыргинэ иvан	н ы л г и н ы ӈ и н ӄ и н э _ г а к к а н т о л е н _ ы н п ы ч ь ы н _ г ы м нин _ ы н и н э л ь ы н  _ ы н ӄ э н э _ к о т ы г ы р г и н э _ и v а н _
ынык ч ыныкъым гъэмэтыленъымэ ынпыӈэв гымнинэ нутэӈэвыт	ы н ы к _ ч _ ы н ы к ъ ы м _ г ъ э м э т ы л е н ъ ы м э _ ы н п ы ӈ э в _ г ы м н и н э _ н у т э ӈ э в ыт _
ынӄэнэ челг гачелгыръоленат гатъылыӈӈоленат	ы н ӄ э н э _ ч е л г _ г а ч е л г ы р ъ о л е н а т _ г а т ъ ы л ы ӈ ӈ о л е н а т  _
ынӄэн уйӈэ гэнъэллин гагалята алымы ӈавкэтльан	ы н ӄ эн _ у й ӈэ _ г э н ъ э л л и н _ г а г а л я т а _ а л ы м ы  _ ӈ а в к э т л ь а н  _
гымыкэ гымыкъымэ яачыкэнатэ	г ы м ы к э _ г ы м ы к ъ ы м э _ я а ч ы к э н а т э _
вытгытчьэн нэмыӄэйэ ӈээккэӄэй нэмыӄэйэ гагалялен	в ы т г ы т ч ь э н _ н э м ы ӄ э й э _ ӈ э э к к эӄэй _ н э м ы ӄ э й э _ г а г а л я л е н _
ынӄоры о’мрыӈа нагтоа’н	ы н ӄ о ры _ о ’ м р ы ӈ а _ н а г т о а ’ н _
гымнинэ игыткин чакэттомгыт ымыльо кымъытвальынтэъым	г ы м н и н э _ и г ы т к и н  _ ч а к э т т о м г ы т _ ы м ы л ь о _ к ы м ъ ы т в а л ь ы н т э ъ ы м _
галвавыӈӈолен ӄынвэт чейвыткук ынӄэнэ	г а л в а выӈӈолен _ ӄ ы н в э т _ ч е й в ы т к у к _ ы н ӄ э н э _
ымы э’чек выква вык ныквынтоӄэн ынӄэнэ	ы м ы _ э ’ ч е к _ в ы к в а _ в ы к _ н ы к в ы н т о ӄ э н _ ы н ӄ э н э _
э’чек выквыӄагтэ тэгнувъэлеӄин ытльата энанымӈыляквъэ ынӄэн	э ’ ч е к _ в ы к в ы ӄ а г т э _ т э г н у в ъ э л е ӄ и н _ ы т л ь а та _ э н а н ы м ӈ ы л я к в ъ э _ ы н ӄ э н  _
ӄытлыги выквылгыӄай тэгнувъэлеӄин тэгныкээӄин ынӄэнэ	ӄ ы т л ы ги _ в ы к в ы л г ы ӄ а й  _ т э г н у в ъ э л е ӄ и н _ т э г н ы к э э ӄ и н _ ы н ӄ э н э _
нивӄинъым ӄэлюӄ мури нылгиныӈинмури ныӈинмуриы’м ынӄэнэ ы’ттъыгрээн тынинтыгъэн выквылгыӄай	н и в ӄ и н ъ ы м _ ӄ э л ю ӄ _ м у р и _ н ы л г и н ы ӈ и н м у р и _ н ы ӈ и н м у р и ы ’ м _ ы н ӄ э н э _ ы ’ т т ъ ы г р э э н _ т ы н и н т ы г ъ э н _ в ы к в ы л г ы ӄ а й  _
уйӈэ эчимгъукыльымури ӄэлюӄ нэмыӄэйъым читъым ынӄэнэ тынэёлӄыльымэ ӈутку рэтлетъёлӄыл и’нничгэ и’нничгу гэтэйкытэ ынӄэн выквылгыӄай	у йӈэ _ э ч и м г ъ у к ы л ь ы м у р и _ ӄ э л ю ӄ _ н э м ы ӄ э й ъ ы м _ ч и т ъ ы м _ ы н ӄ э н э _ т ы н э ё л ӄ ы л ь ы м э _ ӈ у т ку _ р э т л е т ъ ё л ӄ ы л _ и ’ н н и ч г э _ и ’ н н и ч г у _ г э т э й к ы т э _ ы н ӄ э н  _ в ы к в ы л г ы ӄ а й  _
ынӄэнъым ынкъам гым итыкэ	ы н ӄ э н ъ ы м _ ынкъам _ г ы м _ и т ы к э _
чакэттомгыӄай уйӈэ гагаляленъым	ч а к э т т о м г ы ӄ а й _ у й ӈ э _ г а г а л я л е н ъ ы м _
гым ытльата гэнапытӄынлыватлен	г ым _ ы т л ь а та _ г э н а п ы т ӄ ы н л ы в а т л е н _
ынӄэнэ энмэч тъэргииӈит ӈэръамытлыӈгээӈэльэвымэ панэнаъым ынӄэн нылёойгым ытльак ынӄэн	ы н ӄ э н э _ э н м э ч _ т ъ э р г и и ӈ и т _ ӈ э р ъ а м ы т л ы ӈ г э э ӈ э л ь э в ы м э _ п а н э н а ъ ы м _ ы н ӄ э н  _ н ы л ё о й г ы м _ ы т л ь а к _ ы н ӄ э н  _
ялгытык ялгыт ныялгынморэ нытарагӄэнатъым йъэлыги гым ынӄэнэ ытльак тароӈыльын айколятльын нинививым	я л г ы т ы к _ я л г ы т _ н ы я л г ы н м о р э _ н ы т а р а г ӄ э н а т ъ ы м _ й ъ э л ы г и  _ г ы м _ ы н ӄ э н э _ ы т л ь а к _ т а р о ӈ ы л ь ы н _ а й к о л я т л ь ы н _ н и н и в и в ы м _
мэмэй аны мыммэмэа’к	м э м э й _ а н ы  _ м ы м м э м э а ’ к _
ӈэвэӄы’м нинивӄин	ӈ э в э ӄ ы ’ м  _ н и н и в ӄин _
аны евъев евъев	а ны _ е въев _ е въев _
гымъым ӄэлюӄ ынпыӈэвӄэйэ эпэӄэйъымэ ынӄэнэ ынпычьын чакыгэт гымыкытльэн энмэч ынанэ нэмыӄэй гэнмэйӈэвлинэтэ	г ы м ъ ы м _ ӄ э л ю ӄ _ ы н п ы ӈ э в ӄ э й э _ э п э ӄ э й ъ ы м э _ ы н ӄ э н э _ ы н п ы ч ь ы н _ ч а к ы г эт _ г ы м ы к ы т л ь э н _ э н м э ч _ ы н а н э _ н э м ы ӄ эй _ г э н м э й ӈ э в л и н э т э _
